{
  "version": "1.0",
  "module": "CAE",
  "updated": "2026-04-23T00:00:00Z",
  "title": "Constitutional Alignment Engine",
  "description": "Validates constitutional alignment inputs and computes clause-level and aggregate alignment for use by later A.B.E. expansion modules.",
  "authority": {
    "license": "CC BY-NC 4.0",
    "engine_role": "Expansion validator",
    "note": "CAE conditions later modules but does not replace the pioneer spine."
  },
  "weights": {
    "clarity_of_scope": 0.34,
    "constitutional_nexus": 0.33,
    "operational_fidelity": 0.33
  },
  "summary": {
    "alignment_threshold": 0.8,
    "divergence_threshold": 0.8
  },
  "articles": [
    {
      "title": "Article I",
      "clauses": [
        {
          "clause_id": "A1-C1",
          "reference": "Legislative Authority",
          "title": "Legislative Vesting",
          "constitutional_anchor": "U.S. Const. art. I",
          "intent": "Legislative power must remain grounded in constitutional delegation.",
          "statutes": [
            "U.S. Constitution Article I"
          ],
          "regulations": [
            "None"
          ],
          "scope_notes": [
            "Authority cannot exceed delegated constitutional scope."
          ],
          "tags": [
            "delegation",
            "legislative_power"
          ],
          "evidence_links": [
            "doctrine/constitutional-fidelity.html"
          ],
          "alignment_score": 0.95,
          "confidence": 0.95,
          "source_hash": "sha256:1111111111111111111111111111111111111111111111111111111111111111"
        }
      ]
    },
    {
      "title": "Article VI",
      "clauses": [
        {
          "clause_id": "A6-C2",
          "reference": "Supremacy Clause",
          "title": "Federal Supremacy",
          "constitutional_anchor": "U.S. Const. art. VI, cl. 2",
          "intent": "Conflicting lower-order action cannot displace controlling constitutional or federal authority.",
          "statutes": [
            "U.S. Const. art. VI, cl. 2"
          ],
          "regulations": [
            "None"
          ],
          "scope_notes": [
            "State or administrative conflict must yield to controlling federal authority."
          ],
          "tags": [
            "supremacy",
            "preemption"
          ],
          "evidence_links": [
            "doctrine/constitutional-fidelity.html",
            "doctrine/void-ab-initio.html"
          ],
          "alignment_score": 0.94,
          "confidence": 0.94,
          "source_hash": "sha256:2222222222222222222222222222222222222222222222222222222222222222"
        }
      ]
    },
    {
      "title": "Structural Integrity",
      "clauses": [
        {
          "clause_id": "SI-01",
          "reference": "Operational Fidelity",
          "title": "Constitutional Fidelity",
          "constitutional_anchor": "A.B.E. doctrine: Constitutional Fidelity",
          "intent": "Execution must remain aligned with controlling constitutional authority and not drift through administrative convenience.",
          "statutes": [
            "A.B.E. Constitutional Fidelity doctrine"
          ],
          "regulations": [
            "None"
          ],
          "scope_notes": [
            "Execution drift is a measurable constitutional failure."
          ],
          "tags": [
            "fidelity",
            "alignment",
            "execution"
          ],
          "evidence_links": [
            "doctrine/constitutional-fidelity.html"
          ],
          "alignment_score": 0.92,
          "confidence": 0.93,
          "source_hash": "sha256:3333333333333333333333333333333333333333333333333333333333333333"
        }
      ]
    }
  ]
}
